{
  "caption": "Image",
  "name": "image",
  "description": "The Image object describes a specific Virtual Machine or Container image. Defined by D3FEND <a target='_blank' href='https://d3fend.mitre.org/dao/artifact/d3f:ContainerImage/'>d3f:ContainerImage</a>.",
  "extends": "entity",
  "attributes": {
    "labels": {
      "description": "The image labels.",
      "requirement": "optional"
    },
    "name": {
      "description": "The image name. For example: <code>elixir</code>."
    },
    "path": {
      "description": "The full path to the image file.",
      "requirement": "optional"
    },
    "tag": {
      "requirement": "optional"
    },
    "uid": {
      "description": "The unique image ID. For example: <code>77af4d6b9913</code>.",
      "requirement": "required"
    }
  },
  "constraints": {}
}
