{
  "caption": "Reporter",
  "description": "The entity from which an event or finding was first reported.",
  "extends": "_entity",
  "name": "reporter",
  "attributes": {
    "hostname": {
      "description": "The hostname of the entity from which the event or finding was first reported.",
      "requirement": "recommended"
    },
    "ip": {
      "description": "The IP address of the entity from which the event or finding was first reported.",
      "requirement": "recommended"
    }
  },
  "constraints": {
    "at_least_one": [
      "hostname",
      "ip",
      "name",
      "uid"
    ]
  }
}