{
  "caption": "Linux Process",
  "description": "Extends the process object to add Linux specific fields",
  "extends": "process",
  "attributes": {
    "$include": [
      "profiles/linux_users.json"
    ],
    "cgroup": {
      "requirement": "recommended"
    }
  },
  "profiles": [
    "linux/linux_users"
  ]
}
