{
  "caption": "Endpoint Connection",
  "description": "The Endpoint Connection object contains information detailing a connection attempt to an endpoint.",
  "extends": "object",
  "name": "endpoint_connection",
  "attributes": {
    "code": {
      "caption": "Response Code",
      "description": "A numerical response status code providing details about the connection.",
      "requirement": "recommended"
    },
    "network_endpoint": {
      "description": "Provides characteristics of the network endpoint.",
      "requirement": "recommended"
    }
  },
  "constraints": {
    "at_least_one": [
      "network_endpoint",
      "code"
    ]
  }
}